{
  "schemaVersion": "neo.cron-template/v1",
  "owner": {
    "userId": "123e4567-e89b-42d3-a456-426614174000",
    "projectId": "project_01234567",
    "assistantId": "assistant_01234567"
  },
  "input": {
    "ref": "input_ref_0123456789abcdef",
    "fingerprint": "sha256:aaaaaaaaaaaaaaaaaaaaaaaaaaaaaaaaaaaaaaaaaaaaaaaaaaaaaaaaaaaaaaaa"
  },
  "schedule": {
    "expression": "30 1 * * *",
    "timezone": "America/New_York",
    "calculator": "robfig-cron/v3.0.1+go-tzdata"
  },
  "model": {
    "provider": "openai",
    "modelId": "gpt-5.4"
  },
  "budget": {
    "maxWallSeconds": 300,
    "maxModelTokens": 20000,
    "maxToolCalls": 100,
    "maxArtifactBytes": 8388608
  },
  "skill": {
    "installationId": "223e4567-e89b-42d3-a456-426614174000",
    "admissionId": "323e4567-e89b-42d3-a456-426614174000",
    "packageFingerprint": "sha256:1111111111111111111111111111111111111111111111111111111111111111",
    "runtimeBundleFingerprint": "sha256:2222222222222222222222222222222222222222222222222222222222222222"
  },
  "grant": {
    "grantId": "grant_0123456789abcdef",
    "grantFingerprint": "sha256:5555555555555555555555555555555555555555555555555555555555555555",
    "registryFingerprint": "sha256:8888888888888888888888888888888888888888888888888888888888888888",
    "issuedAt": "2026-08-13T00:00:00Z",
    "expiresAt": "2026-08-13T01:00:00Z",
    "capabilities": [
      {
        "capability": "workspace.read",
        "actions": ["list", "read"],
        "resources": {
          "kind": "prefix",
          "values": ["project/"]
        },
        "approval": "automatic",
        "maxCalls": 100
      },
      {
        "capability": "artifact.write",
        "actions": ["publish"],
        "resources": {
          "kind": "exact",
          "values": ["audit-report"]
        },
        "approval": "once",
        "maxCalls": 1
      }
    ]
  },
  "egress": {
    "mode": "none",
    "rules": []
  },
  "secrets": [],
  "automation": {
    "class": "automation_brokered_effect",
    "approvalId": "approval_0123456789abcdef"
  },
  "policies": {
    "missed": "fire_once",
    "catchupWindowSeconds": 3600,
    "maxCatchupRuns": 10,
    "overlap": "buffer_one",
    "maxAttempts": 3,
    "retryBackoffSeconds": 30
  },
  "steps": [
    { "kind": "skill.execute" },
    { "kind": "artifact.publish" }
  ],
  "scopeKeys": [
    "admission:323e4567-e89b-42d3-a456-426614174000",
    "global:*",
    "project:project_01234567",
    "scheduler:*",
    "skill:sha256:1111111111111111111111111111111111111111111111111111111111111111",
    "user:123e4567-e89b-42d3-a456-426614174000"
  ]
}
